{
  "$schema": "http://json-schema.org/draft-07/schema#",
  "title": "orchestrator output contract",
  "type": "object",
  "required": [
    "status"
  ],
  "properties": {
    "status": {
      "enum": [
        "SUCCEEDED",
        "NO_OP",
        "FAILED"
      ]
    },
    "reason": {
      "type": "string"
    },
    "usage": {
      "type": "object",
      "properties": {
        "tokens_in": {
          "type": "integer",
          "minimum": 0
        },
        "tokens_out": {
          "type": "integer",
          "minimum": 0
        }
      },
      "additionalProperties": false
    },
    "digest": {
      "type": "string",
      "minLength": 1
    },
    "plan": {
      "type": "array",
      "maxItems": 5,
      "items": {
        "type": "object",
        "required": [
          "order",
          "action",
          "target",
          "evidence_refs",
          "expected_outcome"
        ],
        "properties": {
          "order": {
            "type": "integer",
            "minimum": 1,
            "maximum": 5
          },
          "action": {
            "enum": [
              "tune_strategy",
              "new_hypothesis",
              "kill_strategy",
              "add_data_source",
              "review_literature",
              "hold"
            ]
          },
          "target": {
            "type": "string"
          },
          "evidence_refs": {
            "type": "array",
            "items": {
              "type": "string"
            }
          },
          "expected_outcome": {
            "type": "string"
          },
          "requested_model": {
            "type": "string"
          }
        },
        "if": {
          "properties": {
            "action": {
              "not": {
                "const": "hold"
              }
            }
          }
        },
        "then": {
          "properties": {
            "evidence_refs": {
              "minItems": 1
            }
          }
        },
        "additionalProperties": false
      }
    }
  },
  "additionalProperties": false,
  "if": {
    "properties": {
      "status": {
        "const": "SUCCEEDED"
      }
    },
    "required": [
      "status"
    ]
  },
  "then": {
    "required": [
      "digest",
      "plan"
    ]
  }
}
